"(70, 100)","(0, 1)",low,no,no,yes,no,"When he knows if then. What he does not know will not hurt him but knowing the notes are fake in case one would discourage him.otes are original, I think it would be nice for them to be so. Since the odds are he gets the fake in either scenario, when he is dnot told in case two I figure he might as well get the fake set. "
"(-1, 0)","(-1, 0)",low,no,no,no,no,"I was trying to increase the bonus amount Alex could seek, if I have properly understood the instructions. "
"(70, 100)","(0, 0)",middle,yes,no,no,no,I want Alex to get real notes.
"(0, 1)","(0, 1)",middle,no,yes,no,no," He knows he may or may not have the fake or real note, so why not give him a bonus? Money is money while a note is just a note."
"(0, 1)","(0, 1)",high,no,yes,no,no,"He had a high chance of getting the original notes.  Honestly, I don't really care which one he gets.  I am sure that he would prefer to get the original notes which is why I selected that option for him."
"(7, 10)","(0, 0)",low,no,no,no,no,I prefer that he knows he got the real ones when he does so he knows how much to value them but if there is a lot of money involved then I think he would prefer the money to the real ones.
"(140, 200)","(200, inf)",middle,no,no,yes,no,I think if he's going to know then I would let him know it's fake and get the 200 bonus
"(45, 70)","(3, 5)",low,no,no,yes,no,"I thought that in most cases it would be best to give him the books with real notes whether he knew it or not, but if the bonus was fairly significant I decided that it would be fine to give him the books with the fake notes even if he knew they were fake."
"(70, 100)","(25, 45)",low,no,no,yes,no,"If he is going to find out that he received fake notes, I want him to feel that he was fairly compensated for this fact and could in turn purchase the real books if he so desires."
"(25, 45)","(200, inf)",low,no,no,yes,no,"I don't like deceiving people and it seems lame that he might get fake notes and not know it. But in the case where he would know it, getting a good amount of money seems like it offsets the fake notes a bit as long as he knows they're fake"
"(15, 25)","(15, 25)",middle,no,no,no,no,"I felt like the value of the real vs fake notes was approximately $25.  Although I preferred the real notes, I was able to choose a book with fake notes with the proper incentive."
"(2, 3)","(2, 3)",high,no,no,yes,no,I don't see a reason to change my answer or action based on whether or not Alex knows or not if he is receiving the original notes. I would like him to receive the original notes. A higher bonus though I would prefer to give to Alex over the original notes though.
"(200, inf)","(100, 140)",high,no ,no,yes,no,"I think the value of the original notes, if known, is worth more than pretty much any amount of money, well more than $200 anyway.  Otherwise I think if you take the bonus money out of the equation the original notes are always more meaningful "
"(200, inf)","(25, 45)",low,no,no,yes,no,"I thought Alex would want the books with the real notes in any event, but in Case 2 I figured he might as well be compensated for the uncertainty once I felt the bonus was high enough."
"(45, 70)","(45, 70)",high,no,no,no,no,"I based it on the monetary value of the bonus. The contents of the published book should be the most important, not the hand written notes."
"(70, 100)","(100, 140)",high,no,no,yes,no,"If he's going to know the outcome, I first prefer he get the real notes. Once the other option gets to about $100, I think it would be less of an issue that the notes are fake. In other words, if he knows, he understands why he got the fake note - because I thought maybe he needed $100+ more. If he doesn't know, I prefer the originals all the way up to $140+. For my own discomfort in enabling him to believe something false. I'd rather he get one of the top two monetary rewards if he gets the fake note and doesn't know it's fake, so that it'd make me a little less antsy about having lied to him."
"(200, inf)","(200, inf)",middle,no,no,no,no,"I don't believe it is right to give them the book with the fake notes. No mater the amount of money, I would think he would want the ones with the original notes since he loves economics so much, I don't think he would appreciate the one with fake notes."
"(70, 100)","(7, 10)",high,no,no,no,no,"Even though no one can tell them apart, there is something more special about the genuine article. It's the same reason that people try to authenticate autographs on baseball cards. I think most would prefer Cal Ripken's autograph over someone's forgery for example."
"(200, inf)","(0, 0)",middle,yes,yes,no,no,I would like for him to get the original ones and the 200.
"(25, 45)","(0, 1)",high,no,no,no,no,I know that Alex admires the authors and so I wanted him to have the genuine notes up until the point that he could profit significantly.
"(200, inf)","(0, 0)",middle,no,no,yes,no,"I originally felt that it would be wrong to use deception or let Alex doubt whether he had authentic notes. I felt that knowing he had authentic notes would be more valuable for him than $200. I contemplate at this point whether changing my answers for the gift could communicate to him the authenticity of the notes by giving $0 bonus, but I'm not sure. "
"(200, inf)","(70, 100)",middle,no,no,no,no,There's no guarantee that Alex will get the originals so I thought it would be appropriate to award the bonus in case he didn't get the originals. I simply drew a line in the sand at $100 since it's a good amount of money.
"(25, 45)","(25, 45)",high,no,no,no,no,I think that is the fairness of the matter at hand
"(200, inf)","(-inf, -1)",low,no,no,yes,no,"Alex will assume fake notes if you don't tell him, so give him fake notes which he will assume. If you do tell him, I suspect he will value the notes more than any money (up to $200). After all, he is likely to earn a lot of money once he graduates, and $200 will seem a pittance to him later."
"(45, 70)","(0, 0)",middle,no,no,yes,no,"I think he would prefer to get the real notes, but if he isn't going to find out and they are indistinguishable then I don't think it really matters. If he knows he's getting fake notes then I said to do that after $45 because that's what I thought was closest to the value of two books."
"(0, 1)","(0, 1)",low,no,no,no,no,There was no reason to not give him the original notes in this case
"(70, 100)","(70, 100)",high,no,no,no,no,$100 is $100. That's the package I would choose and I like economics too!
"(0, 1)","(-1, 0)",high,no,no,no,no,To study the difference in both situations with opposite outcomes
"(25, 45)","(10, 15)",low,no,no,no,no,"I figured if he knew he was getting a fake, he would appreciate the money in a way. Im not sure how logical it was but made sense to me"
"(1, 2)","(-1, 0)",middle,no,no,yes,no,Because I wanted Alex to get a bonus for knowing that he had got a fake one.
"(70, 100)","(70, 100)",high,no,no,no,no,"The 75% probability was the same in both cases. Plus, the professors work at his university. For the right price, he could have the ones with the original notes."
"(70, 100)","(200, inf)",middle,no,no,yes,no,"I felt like Alex, enjoying economics, would really want the original notes. I felt like him not knowing, I would want to ensure he always got the original amount. If he did know, whether he got the fake notes or not, I felt like if he was given information as to what he got, he would appreciate the dollar amount more than which copy he got as he knew."
"(45, 70)","(-1, 0)",low,no,no,yes,no,Well I am giving it as a gift in both cases and the original notes would be important for Alex.   So since he is being told in case 1 I would be happy that he got the notes and knows they are true.   In Case 2 the uncertainty would be troubling for Alex as he would most likely not believe them to be real with a 75% chance so I would rather him get the bonus
"(25, 45)","(70, 100)",high,no,no,no,no,I think knowing the authenticity of the note is important to Alex. So I want him to get a higher bonus if he's isn't being informed about the authenticity of the notes.
"(70, 100)","(0, 0)",low,no,no,no,no,Because if Alex got the fake book with fake notes then he should get compensatated for the fakes.
"(100, 140)","(70, 100)",low,no,no,no,no,"I would rather Alex get the original books, since they're genuine.  But I also want Alex to get more money because that is a nice bonus, so if it's over $100 I would rather he have the fake notes since his bonus will be higher"
"(7, 10)","(0, 0)",low,no,no,yes,no,I was indifferent if he didn't know since the fake and real ones are identical so it wouldn't really matter. If he would be told then it would matter more for him to get the real ones.
"(25, 45)","(7, 10)",middle,no,no,yes,no,"Since in case 1 Alex does not know which notes he got, he would be less disappointed with the books and thus likely value them more than in case 2, where if he gets the fake notes, he will value the books less and thus require additional money to make up the lost value."
"(15, 25)","(25, 45)",middle,no,no,yes,no,I think by not telling Alex I feel like maybe he would like to have a bit of extra money. Maybe it is guilt for not telling him about the originality of the notes.
"(45, 70)","(0, 0)",high,no,no,yes,no,"Well, since Alex won't know for Case 1, I felt it didn't matter much what he got since, at the end of the day, since they're indistinguishable, he will most likely always believe them to be the original. The professor's will also believe so since they can't distinguish it either. For case 2, I feel that at a certain point, the money will be a good bonus for Alex, and despite not getting the original notes, will feel comfort knowing that it's basically identical to the original notes and wouldn't be noticed if he wasn't told"
"(25, 45)","(10, 15)",low,no,no,yes,no,because if Alex doesn't know why should he get a big bonus... If he does know then give him a bigger bonus so if they are the fakes then maybe the bonus could cover the cost of the real ones
"(2, 3)","(-1, 0)",middle,no,yes,no,no,I wanted to confuse Alex by luring him into a false sense of security.
"(0, 1)","(0, 1)",low,no,no,no,no,I feel Alex would rather have the bonus than the original notes from the professors.
"(45, 70)","(45, 70)",low,no,no,no,no,"I wanted him to get the real notes in most cases, unless there was a significant bonus for him. "
"(200, inf)","(200, inf)",low,no,no,yes,no,"I believe since Alex loves economics, it would mean more to him to have the books with the original notes. It's only fair to give them to him in both cases."
"(15, 25)","(10, 15)",middle,no,no,yes,no,"In the first case, he would know which is which so if he got the fake notes, I would prefer he got a larger bonus, since he knows. In the second case, where he will not know, I prefer he get a bonus starting at a lower threshold since he has no clue."
"(200, inf)","(0, 0)",high,no,no,no,no,The value of the bonus would likely be diminished by knowing the authenticity of the notes.
"(70, 100)","(25, 45)",middle,no,no,no,no,Whatevs
"(3, 5)","(70, 100)",high,no,no,yes,no,"If he already knows what book he will be getting, then there is no real reason to give a large surprise bonus to him"
"(5, 7)","(5, 7)",high,yes,no,no,no,I thought it would be fun to try both outcomes and see how they will turn out in the end
"(70, 100)","(0, 1)",middle,no,no,no,no,"Because of the gamefied interpretation I currently have when it comes to this project, it seems like the most fun way to approach it."
"(140, 200)","(45, 70)",high,no,no,yes,no,"i think that the 70 dollars is the tipping point for where i would assess a reasonable value in exchange for the notes, also with him not knowing, but having a feeling that they would be positive, i feel like this would be a fair trade where he would enjoy the bonus but also likely believe that the notes are real. where he knew whether they were real or fake I thought that it was only fair to give the highest value in exchange for fake notes."
"(15, 25)","(0, 0)",middle,no,no,yes,no,"If Alex won't know if the notes are fake or not then he might as well get the bonus. If he knows then he will probably have more personal value towards the real notes, at least to a point."
"(45, 70)","(45, 70)",high,no,no,no,no,It would be nice for him to receive the original note
"(70, 100)","(200, inf)",middle,no,no,yes,no,"In a case where Alex will never learn whether he has fake or original notes it isnt fair to cheat him by giving him fake notes, so there is no amount of cash that should be given to make up for that. In a case where he will be told he has been given fake notes then he can get some cash and do what he will with either the fake notes or the information, i.e. go find the original notes and still have cash in his pocket."
"(45, 70)","(0, 1)",middle,no,no,yes,no,"if you know the notes are original, they have value, but at some point, the money choice is better than having original notes.  if you do not know if the notes are original, they are interesting but have no value.  more money is always the better choice."
"(45, 70)","(25, 45)",high,no,no,yes,no,"My reasoning was that if Alex learns whether the books are original or fake, I would assume Alex would want the original and would only want the fake with incentives only if the incentive was high enough."
"(140, 200)","(0, 0)",low,no,no,yes,no,"I think that it is important for Alex to know if he has original notes, so if they are going to let him know, he should receive the one with original notes.  If he is not going to be told if they are original, it does not make any difference if they are original or not.  "
"(200, inf)","(200, inf)",middle,no,no,no,no,He can always make money but the opportunity to get the books with original notes is priceless
"(15, 25)","(0, 1)",low,no,no,yes,no,"If Alex is going to be told that the notes are fake, he at least deserves a good amount of money to make up for that. But if he doesn't know, then any bonus would seem like a nice little present. "
"(100, 140)","(0, 0)",high,no,no,yes,no,"If Alex does not know if the notes are original or not, it will not impact his value of the books."
"(-1, 0)","(0, 1)",high,no,yes,no,no,I prefare alex getting the original books  he deserves it.
"(200, inf)","(200, inf)",low,no,no,no,no,"The real notes actually written by the professors are more valuable to Alex.  No one wants books with fake notes, even if no one can tell the difference.  The original gifters do know the difference between the books.  It is more valuable to have the actual notes and signatures of the professors.  Plus, Alex should know he has the legitimate notes in his books.  "
"(3, 5)","(0, 0)",middle,no,no,yes,no,If he doesn't know he won't be able to tell the difference anyway.  If we do tell him which notes he got I would rather he get the original ones up to a point.
"(25, 45)","(0, 0)",middle,no,no,yes,no,"In Case 1 he will never know if they were fake or original so he may as well get a bonus for having the fake notes. In Case 2 where he will know, he would probably prefer the original until the bonus makes up for it."
"(0, 1)","(0, 0)",high,no,no,yes,no,"It felt important for Alex to receive the originals in case 1 and it really felt like it didn't matter in case 2, especially since they are indistinguishable."
"(200, inf)","(200, inf)",middle,no,no,yes,no,"Alex loves economics and would really appreciate the original notes. I don't like to deceive people in scenarios like this. Besides, the money is not really a big deal and will be spent. The original notes are the real deal and will last forever, something that Alex will cherish for his whole life."
"(-1, 0)","(-inf, -1)",low,no,no,no,no,Felt there should be different sceanrios in this exercise so as not to be predictable.
"(2, 3)","(1, 2)",high,no,no,yes,no,"I feel that if Alex knows, the book will feel more authentic and there is some value to that. If they should be compensated $3 if they find out they got the fake one since there will be a sense of loss. If he does not know which one they got, than there would not be this sense of loss so the value of the note is less."
"(0, 1)","(-1, 0)",low,no,no,yes,no,I chose depending on whether Alex would find out or not. Wanted to give bonus in either case
"(7, 10)","(7, 10)",low,no,no,yes,no,Well I did not see a difference in telling him or not telling him. What I went off was what I thought was reasonable amount of money to recieve the fake notes and not the real one.
"(200, inf)","(0, 0)",low,no,no,yes,no,"The odds are high that Alex will get the fake ones, so if Alex isn't told, then Alex will assume the notes are fake anyway - so it doesn't matter whether they're real or not, Alex will always assume they're fake."
"(140, 200)","(200, inf)",middle,no,no,no,no,Sometimes my conscience gets me and I want the real thing.
"(200, inf)","(200, inf)",middle,no,no,yes,no,The original notes by the authors who wrote the books seem more worth it than the extra bonus with fake notes. The original books will likely have even more value than the ones with fake notes.
"(200, inf)","(200, inf)",high,no,no,no,no,Alex seems to be very interested in economics and these to authors/professors in particular.  Considering this I think he would much prefer to have books with real handwritten notes form those authors.
"(0, 1)","(0, 0)",low,no,no,yes,no,"I felt bad giving Alex the books with the fake notes and telling him about it.  If he didn't know what he was getting, I was ok with him getting fake notes.  But if we were telling him, I wanted him to have the original books."
"(-1, 0)","(-1, 0)",middle,no,no,no,no,"If the message is the same and was originally created by the author, I don't find as much value in how it was printed on the page."
"(140, 200)","(140, 200)",low,no,no,no,no,"I believe Alex values authenticity over money considerations; however, I arbitrarily chose the highest dollar amount available to include with fake notes if, in fact, Alex received the fake notes because, although I have no control over which notes he gets, I can control whether or not he receives money."
"(140, 200)","(200, inf)",low,no,no,no,no,I want to compensate Alex if I gave a fake one
"(200, inf)","(200, inf)",low,no,no,no,no,I just believe that Alex would really want the originals from these authors no matter what.
"(200, inf)","(70, 100)",middle,no,no,yes,no,"In Case 1, Alex was going to know the authenticity of my gift and I wanted him to feel appreciated. I wanted to appreciate him in Case 2 as well, so I took advantage of the fact that he wouldn't know the difference between the fake and real notes by giving him an extra $100+ on top of the books with the fake notes."
"(70, 100)","(0, 0)",high,no,no,yes,no,"I think that if he knows, good news is best, but if he does not know, then it doesn't matter. "
"(70, 100)","(25, 45)",high,no,no,yes,no,"Because the notes are worth more than the money if they are real, so if he knows for sure I would rather he get a higher amount of money with the fake notes."
"(70, 100)","(70, 100)",low,no,no,no,no,"I think that Alex would prefer original notes in both cases. However, there is a good chance that he would rather receive $100 or more in both cases."
"(1, 2)","(0, 1)",high,no,no,yes,no,"Since he wouldn't know if the notes are fake or original, it is better to choose the option that maximises his bonus option. "
"(70, 100)","(45, 70)",high,no,no,yes,no,"I would lean towards giving him the money sooner in the case where he will not know if the books are real, because I think the money would make him less upset if he is unsure about the books."
"(200, inf)","(200, inf)",middle,no,no,yes,no,"I decided he should have the original ones and not the fake one's especially when the bonus extra amount wasn't very much money. It would need to be over five hundred dollars, in my opinion, to be worth getting fake one's so if he ever discover they are fake and decides to buy real one's he'll have the money to do it to compensate for being duped."
"(100, 140)","(200, inf)",high,no,no,yes,no,"I believe he would enjoy the original notes much more for Case 1, in Case 2 I think since at a certain point he'd rather a larger bonus."
"(200, inf)","(70, 100)",middle,no,no,yes,no,"If he knows then I am not sure the money really does anything to make him happy. However, if he doesn't know then the higher dollar values are a nice bonus to his gift."
"(7, 10)","(0, 0)",high,no,no,yes,no,"In Case 1 Alex won't be informed about the authenticity of the notes. In Case 2 Alex will be informed, but the introduction of monetary bonuses introduces an additional factor that needs to be considered for his benefit and enjoyment."
"(70, 100)","(45, 70)",middle,no,no,yes,no,"Because I think that knowing that the books have original notes would be worth more to Alex, and therefore he'd be willing to ""give up"" more cash to know the notes were real. "
"(0, 0)","(0, 0)",middle,no,no,no,no,"I think the books are cool, but I am not sure that he will care if he has a hand written note or not.  I think an economics person would rather have the gift of the books and a monetary bonus. I personally would not care about the signature and that personal bias played a role in my decision.  "
"(70, 100)","(0, 0)",high,no,no,no,no,"I considered the intrinsic value of the books regardless of the perceived value of the real or fake notes. I know Alex well, and he'll be thrilled with the books either way."
"(140, 200)","(140, 200)",low,no,no,yes,no,Because I figure Alex would prefer the notes that are original since he likes economics and the authors.  Whether he knows if they are fake or not wouldn't change this.
"(200, inf)","(200, inf)",middle,no,no,yes,no,Since Alex love economics I think he would value the original notes over 200 dollars. It does not matter to me if he knows they are real or fake I think he should get the originals either way.
"(0, 1)","(0, 1)",low,no,no,yes,no,Thought he could use the money since the fake notes are almost exactly like the original ones
"(45, 70)","(45, 70)",high,no,no,no,no,"Alex loves economics, and I believe the books with the original notes would be worth quite a lot to him, I believe only at the $70 mark he would begin to care more for the monetary bonus than the notes."
"(70, 100)","(70, 100)",low,no,no,no,no,Generally speaking I want Alex to get the books with the original notes.  But at gifts of $100 or more I think the value of the cash outweighs having the original notes.
"(0, 0)","(0, 0)",middle,no,no,no,no,it seems fair.
"(0, 1)","(5, 7)",middle,no,no,yes,no,"In cases where Alex will know he is receiving fake notes, I don't suggest including a monetary award because he already knows that the notes are fake."
"(140, 200)","(-1, 0)",high,no,no,no,no,The addition of money changed my opinion in that moment. But overall I would still stick with him getting the original over fake notes.
"(25, 45)","(10, 15)",middle,no,no,yes,no,"I figured if he didn't know which one he got, then he could go with less money. If he knew it was the real notes, then he may want more money and the fake notes, but the real notes may be worth more, so I went for $45 and fake instead of $15 and fake."
"(0, 1)","(0, 1)",low,no,no,no,no,Because i thought it better that he get the books with the real notes as they would be more valuable to him.
"(7, 10)","(2, 3)",high,no,no,no,no,Well at first I wanted Alex to have the original book but then I thought if he was a student why not throw in a little cash bonus.
"(15, 25)","(15, 25)",low,no,no,yes,no,"I feel like the more decent thing to do would be to give Alex the real notes, regardless of if he would ever find out or not.  "
"(200, inf)","(200, inf)",low,no,no,no,no,I think if Alex loves economics then having the real author's note will be much more meaningful to him.
"(0, 1)","(-1, 0)",low,no,yes,no,no,I am interested in the dynamics of this study so I wanted to change things up a bit to experiment I guess!
"(15, 25)","(0, 1)",middle,no,no,no,no,"In my opinion receiving money is a more beneficial gift, especially if you can't tell whether the note is real or not.  he could use that money to buy a new economics book.  Unless there was a specific sentimental value about getting the author's signature in the books, I think money would be a more appreciated gift."
"(140, 200)","(70, 100)",middle,no,no,yes,no,Since he will not be told in the second choice Once we hit 100 plus the books its a nice present. And he will never know if the notes are fake. On the other choice (the first one) he will know but 200 is a very nice bonus and he can always go to the prefessors and get some notes written in by them
"(0, 0)","(15, 25)",high,yes,no,no,no,Knowing if the book has authentic notes or not has value.  Personally I don't like having books that have been written in unless it's from the author or something else that should be there.  Books written in by a random person have lesser value to me.
"(2, 3)","(-inf, -1)",low,no,no,no,no,I just answered  according to the instruction .
"(10, 15)","(10, 15)",middle,no,no,yes,no,Because I think regardless of whether or not Alex is told the truth. that is what I deem the original notes to be worth.
"(1, 2)","(1, 2)",low,no,no,no,no,If he’s not getting a bonus with the notes I would like him to get the real ones but it won’t matter with no money.
"(200, inf)","(100, 140)",low,no,no,yes,no,"I feel like Alex really wants the original notes, so that if he knows he gets the fake notes he should get the highest bonus "
