"(200, inf)","(200, inf)",low,no,no,yes,no,"Oddly, I feel like it's dishonest to give him the books with forged signatures and let him believe they're authentic. If someone knows they're fraudulent, they should tell him, and no amount of money would make up for that. Because I chose that for the first part, I thought if he knew, he would definitely prefer the authentic signatures, or the decision should be his to make. "
"(0, 0)","(0, 0)",middle,no,no,yes,no,I'm indifferent on whether he knows whether he receives original or fake notes.
"(200, inf)","(0, 1)",middle,no,no,yes,no,"I feel that Alex would want to get the real notes in Case 1, since they are being informed whether they got the real notes or not. The value of the real notes could potentially be worth more to them than $200. In case 2 they are not being informed about whether they got the real or fake notes, thus I thought it was more ideal that they get a bonus."
"(-1, 0)","(-1, 0)",high,yes,no,no,no,There is no difference between the fake nots and the real notes so Alex might prefer the 200.00
"(15, 25)","(0, 1)",low,no,no,yes,no,Well if you never get told if something is fake or not you might as well get a bonus from it which is why I chose what I chose for case 2. Case 1 I feel like if those fakes are known you should get a decent bonus.
"(70, 100)","(15, 25)",middle,no,no,yes,no,"I lowered the threshold for the cash payout for the ones with the fake notes and him not knowing they are fake. Since he wouldn't know, but I do I want to do what is in his best interest and I think he would value the cash a lot more vs fake notes. "
"(70, 100)","(15, 25)",low,no,no,yes,no,"In the case where he is not told he will most likely believe the book has fake notes and will place less value on it, in which case he would prefer money."
"(15, 25)","(1, 2)",low,no,no,yes,no,I think if Alex knows if he got the original notes it would be worth giving up some of the money that he would have gotten otherwise.  The original notes have some value to them.
"(-1, 0)","(0, 1)",high,no,yes,no,no,i want alex to have the best chance to get the original books so doing it this way in my opinion increses the chances he will get that original
"(-1, 0)","(15, 25)",low,no,no,no,no,This made sense to me in the moment.
"(15, 25)","(3, 5)",high,no,no,yes,no,"If he doesn't know anyways, might as well give him some extra cash, too."
"(0, 0)","(0, 0)",high,no,no,no,no,I couldnt care less what some loser stranger called alex wants. I am truly indifferent whether he gets the fake or real notes and his bonus amount. I get nothing from all this and I don't care at all for making 20000 decisions on his behalf.
"(200, inf)","(100, 140)",middle,no,no,no,no,"I believe that if Alex receives the origional notes, than he has something origional to no other and that would mean more to anyone than money.  With the fake ones, I decided to give him the cash to make up for the fact that he doesn't have anythiung of value to him other than thre book itself."
"(15, 25)","(15, 25)",high,no,no,yes,no,"I just think it would be best if he had the real notes, even if he doesn't know which ones he has. He likes economics and he respects these two authors in particular. it would be nice for him to have the real notes. You can always make money! This could be a once in a lifetime opportunity."
"(15, 25)","(0, 0)",middle,no,no,no,no,The amount determined the responses I gave.
"(15, 25)","(0, 1)",high,no,yes,no,no,I am curious as to see what the outcome of the cases will be
"(200, inf)","(45, 70)",middle,no,no,yes,no,"Money goes a long way to making someone happy, and while I'm sure he'd far prefer the original notes if he was knowledgeable about whether they were fake or not, it seems like a big enough cash reward would make up for the notes being fake so long as he didn't know about their fakeness."
"(0, 1)","(-1, 0)",middle,no,no,yes,no,"I think that if notes are real, it is very nice to know that they are real. It gives them even more meaning. "
"(100, 140)","(0, 0)",high,no,no,yes,no,"Because if you didn't tell him then it wouldn't really matter, but I have a feeling Alex would figure it out. From what I heard he's quite intelligent "
"(15, 25)","(15, 25)",low,no,no,no,no,"While I believe that the two authors are good economists, Their copies with real notes doesn't mean much to me. Maybe they would to Alex?"
"(0, 0)","(0, 1)",middle,no,no,yes,no,"Giving Alex a surprise would definitely feel more enticing and fun. In case 1, by having him not know whether or not the notes were original or fake, it would give him a feeling of wonder. In case 2, by letting him know that the notes are fake and giving him a hefty bonus of cash, I would really like to see how he would react to it and see if his love for economics triumphs the bonus money he would receive."
"(70, 100)","(70, 100)",low,no,no,yes,no,"I responded the same for both cases because I put the same value on the real books, whether or not Alex finds out about them. They are worth the same whether he knows it or not; their value is independent of him."
"(1, 2)","(1, 2)",high,no,yes,yes,no,"I am unsure if we Alex should know if they are fake or not.  He loves the subject so it does feel wrong not to tell him, but it also feels wrong to tell someone you gifted them something fake."
"(45, 70)","(45, 70)",high,no,no,no,no,I felt the payment would be fair if Alex doesn't receive the original copies
"(200, inf)","(200, inf)",low,no,no,no,no,"I feel that considering he loves Economics, he would prefer to receive the ones that have the real response over money. He can make his own money, but from people who he admires and respects, getting a book signed from them both would be quite a high honor to him. "
"(0, 0)","(70, 100)",middle,no,no,yes,no,Case 1 I think he should be compensated fairly because he will not know if the books are original or fake.   Case 2 I think because he is going to know if the books are original or fake the compensation is not  a big deal.
"(0, 1)","(0, 0)",high,no,no,no,no,There was extra money involved so i chose that way
"(200, inf)","(200, inf)",middle,no,no,yes,no,"Given Alex's love of economics and assuming he'd be delighted to have the books with the original notes and would put a high value on them, I think it'd be nice for him to have them even if he doesn't know it. "
"(7, 10)","(0, 1)",low,no,no,yes,no,If you don't know whether the notes are real or not then you might as well get some money from it anyway. I would think he would value the real notes over money unless it was quite a bit of money. Unless he is really poor and you didn't say anything about that.
"(70, 100)","(70, 100)",high,no,no,yes,no,"Alex is very interested in the field of economics and would highly value owning the personally signed books of these two important economics professors. As a result, I would like him to have the originals as I believe that would have been his choice as well. However, when the amount of money to be gained by having the fakes reaches $100 or so, I believe he would profit enough to forgo the originals with the hope that he could get them in the future. Even if he is not told that the books he has received are the fakes, I believe that he might want the cash at a certain point."
"(25, 45)","(7, 10)",low,yes,yes,yes,no,"I believe that Alex is entitled to know which notes are authentic. Ergo, my responses. "
"(200, inf)","(200, inf)",middle,no,no,no,no,"Alex likes economics and he admires both authors, so I believe the books with the original notations by the authors will be more valuable to him than money. I might be prejudice because I'm a book collector, by original notes signed by the author are far more valuable then mere money."
"(200, inf)","(-1, 0)",middle,no,no,yes,no,"In Case 1 I chose for him to get the original books because I thought that was the nicer thing to receive. In Case 2 I was initially indifferent because knowing that it could be real or fake and never knowing which it actually was would create a persistent doubt, such that it really makes no difference if it's real or fake.    I tried to change my answer later upon realizing that I could dispel that doubt by also giving Alex a sizeable cash bonus; he would know it's fake and that I was making it up to him."
"(100, 140)","(70, 100)",high,no,no,yes,no,"I figured if he got fake notes, with knowledge that they were fake, then he deserved a little more bonus to compensate"
"(200, inf)","(200, inf)",low,no,no,no,no,Because Alex is already familiar with the two professors and I wouldn't want to be someone known for gifting him a book with fake notes.
"(0, 1)","(0, 1)",low,no,no,no,no,Whether he gets the real notes or not does not matter as much as getting an actual cash bonus with the books.
"(2, 3)","(70, 100)",low,no,no,no,no,i figured it would be for fun for him to receive a nice bonus
"(200, inf)","(200, inf)",low,no,no,yes,no,Because I believe that Alex would be happiest if he could receive the book with the original notes whether he finds out if they are original or not.
"(15, 25)","(15, 25)",high,no,no,no,no,I just figured $25 was a nice amount to get.
"(3, 5)","(3, 5)",high,no,no,no,no,I just wanted to keep it consistent and chose according to the amount of surprise bonus that was possible.
"(10, 15)","(10, 15)",low,no,no,no,no,I thought Alex would want the original notes more than the bonus money.
"(25, 45)","(2, 3)",high,no,no,yes,no,Because if he didn't know about the originality of the notes he should be rewarded for it in Case 2.
"(70, 100)","(70, 100)",high,no,yes,yes,no,I think that Alex will be intelligent enough to determine the authenticity of the notes whether or not he's told they are the originals or fakes based on his knowledge of the authors after reading the book.
"(140, 200)","(140, 200)",middle,no,no,no,no,The 200 dollar bonus is helpful. I did not see ant harm in getting fake notes and 200 dollars.
"(0, 1)","(0, 1)",high,no,no,no,no,The fake note included an extra $1. I picked the same response because of the extra money.
"(200, inf)","(200, inf)",middle,no,no,no,no,"Authentically signed books are priceless. They represent a unique artefact. Furthermore, they may one day become more valuable than $200 since they are authentically signed!"
"(15, 25)","(7, 10)",high,no,no,yes,no,I think Alex will be a little disapointed knowing they are fake and should be compensated slightly more to make up for that.
"(25, 45)","(25, 45)",middle,no,no,no,no,i dont feel there is any value to having someone fake a note from the author. As an author I would find this upsetting.  as a consumer i felt that if i were to receive the fake notes I would feel better with a cash reward so i set the limit in both cases to $45
"(25, 45)","(25, 45)",high,no,no,yes,no,Wherever he knows or not isn't too relevant to not deceiving. But if I was him I wouldn't care if they were fake or not if I got $45+ for it.
"(45, 70)","(3, 5)",low,no,no,yes,yes,"Reason 1: Alex cannot tell which books are original or fake, so if he doesn't know, then clearly to me, it doesn't matter and the bonus money starts becoming more important at lower amounts (I made the assumption that Alex probably doesn't care about a couple dollars, but higher than $5, it might start making a difference). Reason 2: Alex also values the professors' original notes, but only to a certain extent, and I arbitrarily determined that extent to be roughly over $50 -- since even the profs themselves couldn't distinguish what they wrote, it probably wasn't anything special anyways."
"(0, 1)","(-1, 0)",middle,no,yes,no,no,I thought it would be more entertaining for myself to switch up the selections.
"(25, 45)","(25, 45)",low,no,yes,no,no,"I know if I got something that ended up being a forgery I would be mad and would not accept any type of bonus less than $50, but since that wasn't an option I went with the next closest amount. The whole forgery thing is completely unethical to begin with. This would start a huge feud with me and the person who gifted it to me. "
"(200, inf)","(200, inf)",high,no,no,no,no,The man loves economics. I ain't gonna' give him fake notes. Not for any price.
"(0, 1)","(0, 1)",high,no,yes,no,no,There's no net benefit for me if he gets fake notes. I might as well be nice and make sure he has 100% chance of getting the real notes. It's more meaningful that way.
"(0, 1)","(-1, 0)",low,no,no,yes,no,"If he knows the truth he should be happy with it, but if he doesn't know he should have hope."
"(0, 0)","(-1, 0)",middle,no,no,no,no,I felt that it would be more interesting.
"(5, 7)","(0, 0)",middle,no,no,yes,no,"In case 1 I still thought it would be a nice gesture for Alex to receive a real handwritten copy, even if he couldn't tell if it was real or not. In Case 2, I 100% wanted him to receive a real copy as long as the bonus wasn't over $5 because I thought having a real copy would have value over a fake copy to him. At about the $7 mark, I figured the value of the signature was about the same or less than $7, so he would have preferred the money more."
"(200, inf)","(200, inf)",high,no,no,no,no,I feel that giving Alex the boos with fake notes would be disappointing and unfair. He really admires these authors and tricking him is unfair.
"(0, 1)","(-1, 0)",low,no,no,no,no,"I felt like I wanted Alex to not expect only one answer, and realize that they could have been either fake notes or original notes."
"(10, 15)","(10, 15)",high,no,no,yes,no,"Fifteen dollars felt like enough value to make up for the fact that they were fake notes, regardless of whether Alex would know if they are fake or not. "
"(15, 25)","(15, 25)",low,no,no,yes,no,I felt like $25 dollars was adequate compensation for not getting the original notes whether he knows it or not.
"(200, inf)","(-inf, -1)",low,no,no,yes,no,It did not matter which notes Alex received if he did not know if they were original or fake. If Alex was informed which notes he received I felt better giving him the original notes.
"(200, inf)","(200, inf)",middle,no,no,yes,no,"Even thought Alex will not know if he has the original notes, he has great admiration of the Professors who wrote the books , and I think him having the original notes is important . Money is not everything and I think Alex would appreciate having the originals. "
"(200, inf)","(200, inf)",low,no,no,no,no,"I feel like since he loves these authors that he should always receive the original notes, not the fake ones.  I feel like it's more valuable even though he cannot distinguish between original and fake.  Maybe one day they will be able to tell which is which, and I'd rather him have the original."
"(10, 15)","(-1, 0)",middle,no,no,no,no,"This   is to give alex an extra bonus for receiving the fake note, and make it worth it  "
"(0, 1)","(-1, 0)",low,no,no,yes,no,"Seeing that he would be told if the books are original or fake in those instances I matched what he would be told to what he actually receives. In the case where he was afforded a bonus, being possibly in charge of him getting a bonus I wanted him to have a bonus and granted such."
"(7, 10)","(5, 7)",low,yes,no,yes,no,"In case 2 Alex expects to receive the book with the original notes, I thought it would be fair to reward him with more money because of his expectations."
"(140, 200)","(200, inf)",middle,no,no,yes,no,"I don't like deceiving people, so I wouldn't give him the fake notes without his knowledge under any circumstances.  If he is aware that they are fake, I assume he would probably be placated by the $200 bonus, since the genuine notes are probably not worth more than that amount."
"(25, 45)","(0, 0)",high,no,yes,no,no,I think my two answers were both pretty close if not exactly the same. I just wanted to make sure i was doing the exercise correctly so i wanted to double check my work.
"(5, 7)","(70, 100)",high,no,yes,no,no,"I think the original notes are more valuable even if they are indistinguishable. If I was to get Alex the fake notes, I would feel guilty and hope that he receives a larger bonus. If he gets the real notes, the bonus does not need to be as big."
"(15, 25)","(-1, 0)",low,no,no,no,no,I mainly used my intuition and felt these would be the best choices overall. I felt like certain choices would be more fair as well.
"(5, 7)","(0, 1)",high,no,no,no,no,I think that the case 2 and case 1 responses are what I would have chosen if this was a real-life situation so that's how I went upon choosing.
"(70, 100)","(0, 1)",middle,no,no,yes,no,"I think it matters more if Alex knows whether the notes are real or not. If you're not telling him either way, it doesn't matter as much."
"(200, inf)","(200, inf)",high,no,no,yes,yes,"Alex likes economics. In this case two economics professors have written personalized notes to Alex. So, I reasoned based on how I would feel if I were presented A handwritten note from somebody in a field that I like. A fake note means nothing, a personalized handwritten note means a lot. So in either situation whether you told Alex or did not tell Alex the odds are 75% chance that he is going to receive a handwritten note that is real which to me is worth more than $200."
"(200, inf)","(-1, 0)",middle,no,no,yes,no,"Since Alex is a fan of the authors, I think he'd like to know whether the autographs are authentic.  However, if it's not able to be discerned whether the signatures are authentic, I'd rather have him receive money because he'd never know for sure."
"(0, 1)","(0, 1)",high,no,yes,yes,no,I think that he should get the same books whether he is told about it or not. He deserves to get the original notes.
"(25, 45)","(70, 100)",middle,no,no,no,no,I  gave different responses in Case 1 and Case 2 after a deep thought. I trust that I am wright .
"(70, 100)","(70, 100)",middle,no,no,yes,no,"I'm not sure if I value the knowledge of whether the note is fake or genuine enough for it to influence my decision. The money breakpoint is probably the amount in which I would be less interested in a personal note from an author I admire and more interested in the money, so whether the note is genuine or not is of little interest in that case."
"(3, 5)","(0, 0)",high,no,no,yes,no,I think it is one thing to know and have intention of telling him but another if there is no way he would ever know.  What he doesn't know won't hurt him.
"(10, 15)","(-1, 0)",low,no,no,no,no,"I wanted to cover some ground. I don't necessarily know the wants and needs of Alex, so I don't know if he really needs the money or he could care less. "
"(200, inf)","(200, inf)",middle,no,no,no,no,"I think that since Alex loves economics that it would be cruel to give him the books with the fake notes. And given his love for the subject, I am guessing any financial renumeration is unimportant to him."
"(-inf, -1)","(200, inf)",low,yes,no,no,no,I think chances are 50/50 either way. This is a hard one to decide. If the authors themselves can't tell which ones are fake then I'm not sure any of it matters in the long run.
"(0, 0)","(0, 0)",high,no,no,no,no,"Well I personally do not really care if Alex gets a fake or not, as it does not really effect my life in anyway. I realize that this may sound kind of rude but it is just how I feel."
"(0, 1)","(0, 1)",high,no,no,no,no,I thought the money will be useful to him. The originality of the notes makes no difference to the use of the books.
"(200, inf)","(200, inf)",low,no,no,no,no,Alex is a huge fan of economics and would value the original notes from esteemed economics experts more than a little money and fake notes. That is why my answer is the same.
"(0, 1)","(200, inf)",middle,no,no,yes,no,"In case 2, he knows they're fake, so there's no harm in giving him the fake ones. But he doesn't know in case 1, and so I don't want to be dishonest."
"(100, 140)","(200, inf)",middle,no,no,yes,no,"I think $140 to $200 could make a big difference in most people's lives, and Alex would know that the notes are fake, so I'm not deceiving him.  I think he would prefer to have a book with the fake notes, and $140.  If the amount is reduced to $100, then I'm not sure which he would prefer.  "
"(70, 100)","(1, 2)",high,no,no,no,no,"I figured if he receives the surprise gift with lower payment, then he will know that he has gotten the book with the fake notes. If he has gotten the higher surprise gift, he will know the notes are faked, but the extra money will take away some of the sting of not having the authentic notes."
"(200, inf)","(200, inf)",middle,no,no,no,no,"Alex loves economics, and probably has plenty of money. I think the books with the original notes would be much more valuable to him. "
"(45, 70)","(70, 100)",low,no,yes,no,no,I think that it gives 50/50 probability of getting the original notes with the books.
"(70, 100)","(70, 100)",high,no,no,yes,no,I don't think that Alex's awareness of the situation affects the morality of the situation.
"(200, inf)","(100, 140)",low,no,no,yes,no,"In Case 1 with him knowing, I think Alex would much rather get the original notes since it would mean a lot in a way where any amount of money listed in the surprise bonus wouldn't be worth it. In Case 2 with him not knowing, I think with 75% likely chance that it's fake Alex would be better off getting at least the second highest amount listed since it can provide a good amount of happiness other than the original notes."
"(140, 200)","(140, 200)",low,no,no,no,no,i think it is only right for him to know which book he got.
"(15, 25)","(15, 25)",middle,no,no,yes,no,I think that $25 is not to be scoffed at and that Alex will appreciate the $25 more than original notes in both situations.
"(200, inf)","(200, inf)",middle,no,no,no,no,Because I believe someone interested in economics would want the original notes.
"(200, inf)","(200, inf)",high,no,no,yes,no,"Alex greatly admires these two professors, and over time, he will value having the original notes over having gotten (and spent) $200. I am torn about this, because Alex would have a great story to tell about getting fake notes and money, because I would never use deception on Alex. "
"(15, 25)","(1, 2)",low,no,no,no,no,"With low rewards, he should get the originals. The more the pay, makes up for having a fake."
"(200, inf)","(200, inf)",middle,no,no,no,no,Alex loves economics so he should get the original copies  Fake notes will teach him nothing. he will always have the books to learn from.
"(10, 15)","(7, 10)",low,no,no,yes,no,When Alex is not being told having the original notes is less important.
"(2, 3)","(15, 25)",low,no,no,no,no,"I believe that he would cherish the original notes as opposed to the fake notes. Therefore not receiving any bonus doesn't mater to him.  Otherwise,  to him receiving the fake notes is important but not admirable as much  so giving a bonus  seems more of a thing to do to make up the difference"
"(70, 100)","(70, 100)",low,no,no,yes,no,"I would like for Alex to have the original notes, mainly because he really loves economics! But, with a $100 bonus, he'd still have the books, with or without real notes. Whether he knows or not, a $100 bonus is nice, he'd still have the books, and he'd have cool notes either way. Even fake notes are something to talk about (I mean, IF he knows)"
"(15, 25)","(0, 0)",middle,no,no,no,no,It's just what felt right at the time.
"(200, inf)","(200, inf)",high,no,no,yes,no,I gave the same responses in both Case 1 and Case 2 because I knew that Alex loved economics and had great admiration for the authors of these two books. Having the original notes would therefore feel more meaningful to them than having the fake notes and any bonus.
"(200, inf)","(200, inf)",high,no,no,yes,no,I think he'd valued the original notes highly in all cases and giving them to him would be the kindest option in both cases.
"(200, inf)","(200, inf)",high,no,no,yes,no,"I just think that original and authentic should always be preferred. So whether he knows or not, I think he should be given the original letters or at least know what he has if at all possible. "
"(15, 25)","(15, 25)",middle,no,no,no,no,I guess I am in hopes he will get the original notes. It's worth it to have the original. Once he reaches 25 bucks it's worthwhile to receive the fake notes.
"(0, 1)","(140, 200)",high,no,no,no,no,I figured why not give him more money?
"(200, inf)","(140, 200)",middle,no,no,no,no,It seems to be a case of how much are the original notes worth to someone. The original notes are something special to treasure and money will just be spent and never seen again.
"(15, 25)","(70, 100)",high,no,no,yes,yes,"In case 1, Alex is blissfully ignorant of the originality of the notes. Due to this ignorance, awarding a larger bonus made more sense if the notes were fake. In case 2, he knows the notes are fake and must be compensated for any perceived loss due to their lack of originality. This compensation has to be high enough to not cause him a deep feeling of loss."
"(-1, 0)","(-1, 0)",middle,no,no,no,no,"Since Alex loves economics and the work of these two authors, I think he would much prefer to have the original notes than the fake ones."
"(45, 70)","(0, 0)",middle,no,no,yes,no,"Most people would want to have the one with the original notes. Most people love an original much more than a fake. However, as in Case 2, if they are never going to know whether they are original or fake then the end result is the same as far as their perception is concerned and it does not matter which one they get."
"(0, 1)","(0, 0)",high,no,no,no,no,I gave him the original when we tell him when we don't give him a cash bonus because he will view the fake notes lesser even though they seem identical.
