"(15, 25)","(10, 15)",low,no,no,yes,no,I felt that having some kind of bonus along with the uncertainty of not being told which books he got would be somewhat more of a consolation to him.
"(70, 100)","(70, 100)",high,no,no,no,no,"I think that Alex would enjoy the book and a gift of $100 more with or without real or fake notes. Regardless, there is a 25% chance that he will receive fake notes, so I think that with or without fake notes the $100 or more would still make the gift valuable. "
"(45, 70)","(45, 70)",high,no,no,yes,no,"I think that he should be told and I think he should get the original notes. Even though the fake ones can't be distinguished between the real ones, they're still fake. Real ones are always better no matter what. "
"(100, 140)","(100, 140)",middle,no,no,yes,no,"I wanted Alex to have the original in any case, because the value was there whether he knew it or not."
"(140, 200)","(70, 100)",high,no,no,yes,no,Because in the first one he will never know and can't tell the difference so why not give him a little money too.  But in the 2nd one he will know and I think that it's important to him to have the original notes however 200 is a good amount of money.
"(200, inf)","(200, inf)",middle,no,no,no,no,If the choice were given to me personally that's what I'd choose. A book with authentic notations by an author I truly respect is absolutely worth more than $200.
"(70, 100)","(70, 100)",high,no,no,no,no,"I think the extra money is enough to warrant the fake notes. The fake notes will still provide insight and be interesting to a reader like Alex who is a fan, the extra money will be a nice a bonus added on top of that. "
"(200, inf)","(200, inf)",middle,no,no,yes,no,My responses are the same because whether Alex knows or not he should be given the originals. In my world deception is not an option.
"(25, 45)","(15, 25)",middle,no,no,no,no,would not want to give someone fake items espically from a book. If i had to choose fake i would want this person t be compensate because i feel like i cheated him and was not honest im not a liar.
"(0, 1)","(0, 0)",high,no,yes,no,no,"I felt like there may be a bigger bonus if the answer was different, so I chose indifferent in Case 2.  "
"(0, 0)","(0, 0)",low,no,no,no,no,I gave the same answer because I don't truly feel like I am actually shouldering the responsibility of the decision. They highest likelihoods in both scenarios are for receiving fake one. I feel like everything is more left up to chance.
"(0, 1)","(0, 1)",middle,no,no,no,no,I think he should receive the original notes book unless there's money involved then I was okay with giving the fake notes.
"(0, 1)","(70, 100)",low,no,no,no,no,Because the books seem good though it's fake
"(45, 70)","(0, 0)",high,no,yes,yes,no,In case two I wanted to give him a chase to see if he really wanted the book after knowing it was original or fake.
"(200, inf)","(200, inf)",high,no,no,no,no,I just want Alex to get the original notes because he is so interested in economics and admires the authors of the books.  The monetary bonus while getting the fake notes is completely irrelevant to me because that is not what he is seeking.
"(200, inf)","(200, inf)",low,no,no,yes,no,"Alex loves economics. I'd want him to have something that's authentic to it, whether he'll ever know it or not. I think there's more value in something original like that."
"(0, 0)","(0, 0)",middle,no,no,no,no,"I gave the same response of indifference, so I'm not sure why you're asking this. Since there's no detectable difference between the notes, I'd want to maximize the bonus."
"(140, 200)","(200, inf)",middle,no,no,yes,no,"In a case where you were not going to tell Alex if the notes were real or fake, I always wanted him to have the real notes because I believe that as someone who loves economics he would really enjoy having authentic notes from the famous authors.  When you were going to tell Alex about the authenticity of the notes, I still believed he would prefer the books with real notes over a relatively small cash bonus.  However, I did believe that he would like the largest cash bonus of $200 and the books with fake notes, as long as you were honest with him about them being fake.  "
"(200, inf)","(0, 1)",high,yes,no,no,no,"I just felt since he loves Economics, he should get the real notes"
"(0, 1)","(0, 1)",middle,no,no,no,no,I think the sentiment of having the originals would be important/appreciated by him.
"(0, 0)","(0, 0)",low,no,no,no,no,"I am indifferent.  I do not care what books Alex gets.  It is an unrealistic scenario and I have no stake in this fake scenario, so who cares?"
"(3, 5)","(1, 2)",high,no,no,no,no,"I thought he should get more for the fake ones, because he was not being told he would get them"
"(200, inf)","(200, inf)",low,no,no,no,no,I just personally think it is better if he receives the books with the real notes.  No amount of bonus changed my mind about that.
"(140, 200)","(140, 200)",middle,no,no,no,no,"I feel that overall the books should be the original since that has the most meaning to him, and I also think that even if it is fake or not he would still appreciate the gift no matter what."
"(200, inf)","(140, 200)",high,no,no,yes,no,case 1 he will not know the difference so give him $200 to enjoy.  Case 2 he will know so we'll let him just be happy knowing he got the author's notes
"(200, inf)","(200, inf)",low,no,no,no,no,I think Alex would prefer the original notes because he likes economics very much.  The original notes mean more to him than the money
"(70, 100)","(70, 100)",middle,no,no,no,no,"Not sure how much money Alex has, but I would think $100 would be a carrot to dangle in front of him and cause him to forego the REAL signed books.  That's my opinion and I'm sticking with it....."
"(15, 25)","(-1, 0)",low,no,no,yes,no,"In Case 1, I would rather Alex get the books with the original notes because he would want to know that those are the books he would get. Not telling Alex which books he will get in Case 2 would mean that he wouldn't know whether the notes were original or fake; however, he would get a bonus with the fake notes if I chose that for him. "
"(25, 45)","(15, 25)",low,no,no,no,no,Because I fi knew I had a fake I would want more $$$$.
"(45, 70)","(0, 0)",low,no,no,yes,no,"Because in one of the cases he won't know, so it doesn't matter to me which one he gets, he knows it's most likely a fake."
"(10, 15)","(10, 15)",middle,no,no,no,no,"To be honest, I don't know Alex, and while I would prefer they receive the authentic notes if all else were equal, there is a point where I'd rather have the money. If I knew Alex, or had some potential interaction with them, my answers might be different."
"(45, 70)","(-1, 0)",high,no,no,no,no,Because the question is good and the question seems fake at times
"(25, 45)","(-inf, -1)",high,no,no,yes,no,If we do not tell Alex if he is getting the fake notes then I feel less of a sense of guilt knowing that he probably would have preferred the original.
"(200, inf)","(70, 100)",low,no,no,yes,no,I believe that if Alex doesn't know if the notes are fake that he won't be as disappointed to have the bonus of the cash to go with the book he will enjoy anyway. If Alex knows the notes are fake he might not be as excited to have the bonus cash as he would if he thought he got it and real notes from the authors.
"(7, 10)","(-1, 0)",high,no,yes,no,no,I'm confused and not understanding
"(1, 2)","(0, 1)",middle,no,no,no,no,Because I prefer Alex getting surprise bonus for getting fake books.
"(45, 70)","(45, 70)",high,no,no,no,no,"I felt that at the $70 price point Alex could use the money (if he chose) to get the books and ask the professors to handwrite a real note. If he didn't find it worth it, he could keep the really well done fakes and take himself to a sympathy dinner and drinks. "
"(5, 7)","(5, 7)",middle,yes,no,yes,no,"I would really prefer that Alex get the original notes, whether he knows or not."
"(100, 140)","(1, 2)",high,no,no,no,no,"If he isn't going to know that it is real when it is actually fake, he may as well get some money with his gift."
"(70, 100)","(10, 15)",middle,no,no,yes,no,"My response were different because I think if he knows he is getting the fake notes, it is better to give him a bigger surprise bonus to make up for the fact that he didn't get the genuine notes."
"(200, inf)","(0, 0)",middle,no,no,yes,no,"If he is told whether the notes are real or not, he will add or remove value to the books based on that knowledge. He loves economics and the value of the books to him would be much more than $200 so I chose for him to have the book over the bonus money for case 1. "
"(45, 70)","(200, inf)",high,no,no,yes,no,"i think having access to the truth is an important aspect of agency, and i respect alex's agency. when he is not told whether the notes are original or fake, i feel it's important to preserve his ability to guess correctly. "
"(1, 2)","(0, 1)",low,no,no,yes,no,"Case 1 where Alex doesnt know if the notes are real or fake, I feel I can get away with hiding it.  If Alex is going to learn, I still want to make as much as I can and he gets a bonus anyhow"
"(200, inf)","(200, inf)",middle,no,no,no,no,The authenticity of having the original notes far outweighs the bonus money.
"(70, 100)","(0, 0)",low,no,no,yes,no,"Well, in the case where he is not told whether the notes are real or fake it will make no difference to Alex"
"(140, 200)","(140, 200)",high,no,no,no,no,Because I would want Alex to receive the original notes in most cases.
"(45, 70)","(45, 70)",high,no,yes,yes,no,"I think Alex should get the real books regardless if they know they are real or not. As for the bonus, I chose the split that I'd like best."
"(25, 45)","(15, 25)",low,no,no,yes,no,"I feel like in the instance where telling Alex that the notes are fake he should receive more monetary compensation. In the case where he doesn't know if the notes are fake, the monetary compensation is just a nice little bonus."
"(25, 45)","(7, 10)",middle,no,no,yes,no,"If you tell Alex the truth, then I think some extra cash would help ease the fact that he got fake notes. But if he doesn't know any better, then I don't think it matters too much either way, though I think there ought to be a preference for the original notes anyways."
"(10, 15)","(10, 15)",middle,no,no,yes,no,"If Alex either knows the true nature of the notes/ signatures, he may not be able to get anything more than a few bucks for the books, should he decide in the future to sell or pawn them.  If he decides to keep them, he won't be able to tell whether they are authentic (if he wasn't informed), and anyone buying the books won't be able to tell either.  Beyond that consideration, how much would he get for them...who really values signed books from prize-winning economists??"
"(25, 45)","(45, 70)",high,no,no,no,no,I want Alex to have the option to sell the books and make some decent cheddar.  If he has the original notes it seems like the books will have more value...if he is going to get a fake for sure then I want him to have some up front money.
"(140, 200)","(70, 100)",middle,no,no,no,no,"  If  the notes are fake than I want him to have a high bonus, because that would probably make him happy.  If the notes are real no bonus is necessary."
"(70, 100)","(70, 100)",low,no,no,yes,no,"I feel like he'd appreciate getting the real notes regardless of whether or not he knows it. he might be able to intuit that they're fake even if he doesn't know from prior knowledge. Also, since he loves economics so much, I doubt this guy is poor, so any bonus below 100 is likely meaningless to him."
"(0, 1)","(0, 1)",low,no,no,no,no,I felt like he deserved to just get the real ones in any case.
"(45, 70)","(45, 70)",low,no,no,yes,no,The extra money would probably be worth more to him than whether or not the notes weren't fake.
"(15, 25)","(15, 25)",low,no,no,no,no,"I would prefer the original notes rather than the fake ones and so I think Alex would too. However, since no one can tell that the fake notes are fake I think that $25 or more would be a nice bonus."
"(2, 3)","(2, 3)",middle,yes,no,no,no,Because I really want Alex to get the original notes.
"(200, inf)","(200, inf)",middle,no,no,yes,no,"I guess the matter of the notes being original or fake was more important to me than the bonus money. Obviously I don't know Alex's financial situation, but I don't like the idea of being dishonest about authenticity. Whether you told him that the books were original or fakes wasn't really important to me because the underlying question is the same in my mind: it's about being straight-forward. Giving him the books with the fake notes (whether or not he knows) just seems fundamentally dishonest to me and no amount of money magically makes that untrue. I just thought that giving him the originals, regardless of the money, was the option in both cases that maintained my integrity. "
"(200, inf)","(200, inf)",high,no,no,no,no,I think Alex deserves the books with real notes. Fake notes would be a bad thing. No money would pay for it.
"(-inf, -1)","(25, 45)",low,no,no,no,no,"I think the price I set at the beginning was too high, so I decided a slightly more reasonable value"
"(140, 200)","(140, 200)",middle,no,no,yes,no,I just want him to have the same gift and bonus regardless of what you tell Alex.
"(70, 100)","(70, 100)",low,no,no,yes,no,"Whether or not Alex is told which notes he got, I feel that he would value the books with the real notes almost to the level of $100. I would like for him to receive the books with the original notes as I know it would mean a lot to him, but at a certain point I think he'd prefer money."
"(140, 200)","(140, 200)",low,no,no,yes,no,It doesn't matter if he knows or not. I don't know a single person that couldn't use an extra $200
"(70, 100)","(0, 0)",low,no,no,yes,no,"If he has knowledge of which one is fake and real, then he should the original ones. If he's not able to find the knowledge of which one is fake or real, it really doesn't matter what he receives."
"(200, inf)","(200, inf)",middle,no,no,no,no,Books by experts in one's field of interest with notes from the author are more personally valuable than the bonuses offered.
"(200, inf)","(200, inf)",high,no,no,no,no,Because both his odds on getting real was 75%
"(0, 1)","(0, 0)",high,no,no,yes,no,I gave different answers because to me it mattered if he would be told which book he was getting and what his bonus would be.
"(-1, 0)","(0, 1)",low,no,no,no,no,I gave different responses because it would interesting to see different scenarios.
"(7, 10)","(7, 10)",high,no,no,yes,no,I did not find it particularly important if Alex will be informed or not about the notes.
"(0, 1)","(25, 45)",high,no,no,yes,no,he probably be blessed if he had no knowledge which one is fake or original
"(15, 25)","(25, 45)",middle,no,no,yes,no,Just because of the difference in knowing and not knowing they are real original or not.
"(70, 100)","(45, 70)",middle,no,no,yes,no,"in Case 2, since he will not be told, I placed a lower threshold to the cash amount simply because of the uncertainty involved. I chose a monetary value that I felt reflected the 'uncertainty' premium."
"(3, 5)","(0, 0)",high,no,no,yes,no,I made different choices based on whether or not Alex would learn if the notes were genuine.
"(70, 100)","(70, 100)",middle,no,yes,no,no,"I didn't give different responses. At least not for which books I'd prefer Alex to have, unless I clicked something wrong. "
"(45, 70)","(45, 70)",middle,no,no,yes,no,"It didn't really matter to me whether Alex knew or not whether he got the original or fake notes. I was just trying to think how much value the original notes would have for him, and I felt that he would rather have the $70 rather than the original notes."
"(200, inf)","(200, inf)",high,no,yes,no,no,Because he will have the original notes no matter what that way. $200 isn't enough to receive fake notes
"(70, 100)","(0, 0)",low,no,no,yes,no,if they are real- he deserves to know. and would feel more valuable and authentic to him. but if fake- it's probably better to not really know the truth.
"(0, 1)","(-1, 0)",low,no,no,yes,no,I wanted Alex to know when he was told that he received the original. There is no value in them being fake in this case. When he is not told I wanted to align with the given assumption that they were fake.
"(140, 200)","(15, 25)",high,no,no,yes,no,The first case I thought just go ahead and give him a little cash since he will not ever know.  In the second case I was thinking he would want the books more so if he didn't  get them give him good lump of money to make up for it.
"(-inf, -1)","(1, 2)",high,yes,no,no,no,I looked at the bonus Alex would receive. I felt that a bonus with a fake note would be fair compensation.
"(70, 100)","(100, 140)",low,yes,no,yes,no,"I just felt like since Alex knew the notes were fake, he should receive a different level of compensation."
"(10, 15)","(0, 0)",middle,no,no,yes,no,I so no reason to tell him if the notes are fake or original. If he doesnt know it doesnt matter. If he will be told then its just best to be honest.
"(70, 100)","(45, 70)",middle,no,no,yes,no,"If Alex is not knowledgeable about whether the notes are real or not, and cannot find out, he would probably rather have the money. I perceive having original notes from the authors as having some value for Alex, so knowing if they are real or not has value to him."
"(0, 1)","(0, 0)",high,no,no,no,no,"I was really basing it on the fact that the notes are indistinguishable. Since they are for all intents and purposes the same, I thought that it would be best to get the fake ones with a cash bonus. I probably should have went for a larger bonus, however."
"(0, 0)","(0, 0)",low,no,no,no,no,I really do not care whether a stranger gets the real or fake handwritten notes
"(70, 100)","(0, 1)",high,no,no,yes,yes," In Case 1, where Alex is informed about whether the books he got have original or fake notes, my response considered the impact of knowledge on Alex's actions. If he knows about the notes' authenticity, he can make informed decisions about using the money and the potential legal consequences. In Case 2, where Alex is not informed, my response focused on the immediate practical value of the money without considering potential ethical or legal implications, since he's unaware of the notes' nature. The differing responses stem from whether Alex's knowledge of the notes' authenticity affects his decision-making process."
"(200, inf)","(-1, 0)",low,no,no,yes,yes,"In Case 1 where Alex is not informed about whether the books contain original or fake notes, I provided a response that leans toward Alex being better off. This is because not knowing the authenticity allows him to enjoy the possibility of having genuine notes without the disappointment of finding out they're fake.    In Case 2, where Alex is informed about the authenticity, I suggested that he might be worse off. This is due to the potential disappointment he might feel upon discovering the books contain fake notes, which contrasts with the anticipation of receiving original ones.    The reasoning behind these responses is to consider the emotional impact and psychological factors associated with expectations and outcomes in each scenario."
"(70, 100)","(70, 100)",low,no,no,no,no,I thought about the value of the books with the notes and without the notes. I thought the books with the notes would be worth more. I also put myself in Alex's place and thought which one I would want more.
"(140, 200)","(25, 45)",low,no,no,yes,no,"If Alex is told they received the original notes, they would need to be compensated highly if receiving the fake notes."
"(200, inf)","(200, inf)",middle,no,no,no,no,"I can't think of anything worse than giving fake notes, if I wanted to give cash I would have.    I see the notes as MORE important than the books. "
"(200, inf)","(45, 70)",middle,no,no,yes,no,"I think it is right to give Alex books with original notes if he is aware that they are original, but if he is not aware, he can still appreciate the book and the extra tips"
"(25, 45)","(0, 1)",high,no,no,no,no,That is how I feel.
"(10, 15)","(10, 15)",low,no,yes,no,no,i wanted him to get the original notes
"(70, 100)","(45, 70)",middle,no,no,yes,no,I chose to give Alex the original notes for the majority because he loves economics and I think it would mean a lot to him. I chose the $100 mark for telling him because I think he would be appreciative of the special bonus. I chose the $70 mark for when he does not know because either way Alex would not know.
"(45, 70)","(-inf, -1)",low,no,no,yes,no,"On the one hand, I would like Alex to get an authentic version.  On the other hand, ignorance is bliss.  He might be better off just not knowing."
"(0, 0)","(0, 0)",low,no,no,no,no,"Since the fake notes are indistinguishable, I honestly don't think it matters if he's getting the book for free anyway. Also, it seems the bonus is higher with the fake notes. For myself, I would rather have money than a signature. "
"(0, 1)","(0, 0)",low,no,no,yes,no,I felt that not being told didn't really matter as much as being told whether he got the original or fake notes. I thought that it would be better to get the original if he did in fact know.
"(-1, 0)","(-1, 0)",middle,no,no,no,no,I chose the answer I did based solely on the bonus of $1.
"(70, 100)","(0, 0)",high,no,no,yes,no,"I believe Alex would like the extra cash so as the bonuses went up, I chose fake notes instead. "
"(200, inf)","(200, inf)",high,no,no,no,no,he loves economics and the value of the original author's notes is invaluable.
"(15, 25)","(45, 70)",low,no,no,no,no,"The probability of him getting the fake notes was higher in case 2, so I thought that should change the money he'd get"
"(200, inf)","(200, inf)",high,no,no,no,no,I'm assuming since Alex is such an economics fan he would appreciate the real notes over the cash payout.
"(0, 1)","(1, 2)",high,no,no,no,no,I wanted to be reasonable with the choices I made.
"(140, 200)","(-1, 0)",middle,no,yes,no,no,I thinks its a 50-50 chance.
"(200, inf)","(70, 100)",high,no,no,no,no,The increased dollar amount of the bonus affects my answer.
"(0, 1)","(0, 1)",middle,no,no,no,no,I FEEL ALEX WILL NEVER KNOW THE DIFFERENCE
"(200, inf)","(140, 200)",high,no,no,yes,no,"Since he will not know I figured $200 is a nice bonus for him.  On the other hand since he will know, I would be sure he would rather have the original notes instead of the $200."
"(70, 100)","(45, 70)",middle,no,no,no,no,"I feel like with his love for economics, if he knows that the copies he receives are not the originals, a higher compensation/bonus would make him feel better, or else, he'd probably prefer the original versions more. "
"(200, inf)","(200, inf)",middle,no,no,no,no,I would rather Alex receive the books with the original notes because ethically it feels like the right thing to do.
"(70, 100)","(1, 2)",high,no,no,yes,no,"I would think if Alex is none the wiser, they would probably prefer to have the books AND the money ."
"(3, 5)","(7, 10)",low,no,no,yes,no,Case 1 Alex won't know if he gets the fake notes so I figured I'll give him the money later so he gets a cash bonus.  Case 2 he will know if it's fake or not so I gave him the bonus money sooner than Case 1.
"(15, 25)","(10, 15)",middle,no,no,yes,no,I gave a larger amount in case 2 because Alex deserves a little more now that he knows the notes are fake.
"(0, 1)","(0, 1)",high,no,no,no,no,"because it doesnt matter to me what is going on with him, so i just went with the same answer for both because its not relavent to me what happens to him."
"(70, 100)","(70, 100)",high,no,no,no,no,Because I feel that the original notes would be a better outcome.
"(25, 45)","(25, 45)",low,no,no,no,no,I guess I'd just rather him get the originals because thats cooler and that's what I would want
"(0, 1)","(140, 200)",middle,yes,no,no,no,because I think he should get the highest paying bonus LOL
"(70, 100)","(200, inf)",middle,no,no,yes,no,"Honesty is the difference.  Not telling him, though it isn't lying since he knows it's a possibility, feels wrong to leave him with fakes he thinks might be real at any price.   Once he knows which is which it's a matter of value.  As I don't know how much he values money over genuine copies, I had to guess."
"(15, 25)","(70, 100)",high,no,no,yes,no,I think not telling Alex if the notes are fake or not as a negative.  So I think his bonus should be higher in Case 2.
"(25, 45)","(25, 45)",middle,no,yes,no,no,"The notes are worth something to someone who loves economics, but they're probably not worth more than the books themselves."
"(45, 70)","(25, 45)",low,no,no,yes,no,"In case 2, Alex does not know if the notes are real or fake.  I felt that the monetary reward should start a little bit earlier, since Alex will never know the truth about the notes.  I believe the real notes add some value to the books."
"(0, 0)","(0, 0)",high,no,no,no,no,"Well based off what I was told, the ""fake notes"" have to be equally as good. The professors couldn't even tell the fake notes from the real ones, so as long as they are of equal quality I don't think it matters much which he gets."
"(15, 25)","(15, 25)",low,no,no,no,no,I think $25 is a good point where the money would make the fake notes more worth it
"(-1, 0)","(-1, 0)",low,no,no,yes,no,By telling or not telling Alex about the fake or the original the possibility of him getting the fake books is high.
"(70, 100)","(70, 100)",low,no,no,yes,no,I think $100 is a nice little bonus no matter if he knows if they notes are fake or not. I think he would appreciate at least that amount knowing the notes are fake.
